{
  "schema_version": "2.2.0",
  "graph_id": "a1b2c3d4-e5f6-7890-abcd-ef1234567890",
  "run_id": "0bc666d1-92a3-4fa5-9c44-0ef402cc65c6",
  "issue_key": "TICKET-2327",
  "risk_tier": "high",
  "approved_ac_version": 2,
  "topology": "sequential",
  "integrator": {
    "owner": "backend-builder",
    "responsibilities": ["Cross-cutting idempotency and SMTP ordering across work items"]
  },
  "work_items": [
    {
      "id": "blob-fetch",
      "description": "Fetch attachment bytes from blob storage with SAS validation",
      "owner": "backend-builder",
      "depends_on": [],
      "ac_refs": ["ac-1"],
      "files_hint": ["**/Blob*", "**/Attachment*"],
      "evidence_required": ["unit-tests", "build-pass"],
      "status": "completed",
      "receipt_id": "b52a05e2-0000-4000-8000-000000000010"
    },
    {
      "id": "attachment-validation",
      "description": "Validate type, size, and extension per AC",
      "owner": "backend-builder",
      "depends_on": ["blob-fetch"],
      "ac_refs": ["ac-1"],
      "evidence_required": ["unit-tests"],
      "status": "completed",
      "receipt_id": "b52a05e2-0000-4000-8000-000000000011"
    },
    {
      "id": "idempotency",
      "description": "Idempotency key storage and reclaim semantics",
      "owner": "backend-builder",
      "depends_on": ["attachment-validation"],
      "ac_refs": ["ac-2"],
      "evidence_required": ["unit-tests", "security-review"],
      "status": "completed",
      "receipt_id": "b52a05e2-0000-4000-8000-000000000012"
    },
    {
      "id": "smtp-send",
      "description": "SMTP send with MarkSending after successful delivery",
      "owner": "backend-builder",
      "depends_on": ["idempotency"],
      "ac_refs": ["ac-2"],
      "evidence_required": ["unit-tests", "integration-tests"],
      "status": "completed",
      "receipt_id": "b52a05e2-0000-4000-8000-000000000013"
    }
  ],
  "verification_plan": [
    { "step": "implementation-validator", "after": ["smtp-send"], "required": true },
    { "step": "bugbot", "after": ["all_work_items"], "required": true },
    { "step": "security-review", "after": ["bugbot"], "required": true },
    { "step": "documentation-writer", "after": ["step6_human_approval"], "required": true }
  ],
  "plan_stability": {
    "changes_after_build_started": 1,
    "last_modified_at": "2026-08-31T18:00:00Z"
  },
  "created_at": "2026-08-31T17:30:00Z"
}
